{
  "entries": [
    {
      "operationName": "agent-skill-children",
      "operationType": "ACTIVATE_RUNTIME_LINK",
      "reasons": [
        "Runtime target already links every source child to the canonical source."
      ],
      "source": {
        "exists": true,
        "kind": "DIRECTORY",
        "path": "/Users/amichne/code/intelligence/skills",
        "resolvedPath": "/Users/amichne/code/intelligence/skills",
        "type": "FILESYSTEM_PATH_CHECK"
      },
      "status": "ALREADY_ACTIVE",
      "target": {
        "exists": true,
        "kind": "DIRECTORY",
        "path": "/Users/amichne/.agents/skills",
        "resolvedPath": "/Users/amichne/.agents/skills",
        "type": "FILESYSTEM_PATH_CHECK"
      },
      "type": "RUNTIME_ACTIVATION_PREFLIGHT_ENTRY"
    },
    {
      "operationName": "claude-agent-children",
      "operationType": "ACTIVATE_RUNTIME_LINK",
      "reasons": [
        "Runtime target already links every source child to the canonical source."
      ],
      "source": {
        "exists": true,
        "kind": "DIRECTORY",
        "path": "/Users/amichne/code/intelligence/agents",
        "resolvedPath": "/Users/amichne/code/intelligence/agents",
        "type": "FILESYSTEM_PATH_CHECK"
      },
      "status": "ALREADY_ACTIVE",
      "target": {
        "exists": true,
        "kind": "DIRECTORY",
        "path": "/Users/amichne/.claude/agents",
        "resolvedPath": "/Users/amichne/.claude/agents",
        "type": "FILESYSTEM_PATH_CHECK"
      },
      "type": "RUNTIME_ACTIVATION_PREFLIGHT_ENTRY"
    },
    {
      "operationName": "codex-hook-adapters",
      "operationType": "ACTIVATE_RUNTIME_LINK",
      "reasons": [
        "Runtime target already links every source child to the canonical source."
      ],
      "source": {
        "exists": true,
        "kind": "DIRECTORY",
        "path": "/Users/amichne/code/intelligence/hooks/codex",
        "resolvedPath": "/Users/amichne/code/intelligence/hooks/codex",
        "type": "FILESYSTEM_PATH_CHECK"
      },
      "status": "ALREADY_ACTIVE",
      "target": {
        "exists": true,
        "kind": "DIRECTORY",
        "path": "/Users/amichne/.codex/hooks",
        "resolvedPath": "/Users/amichne/.codex/hooks",
        "type": "FILESYSTEM_PATH_CHECK"
      },
      "type": "RUNTIME_ACTIVATION_PREFLIGHT_ENTRY"
    },
    {
      "operationName": "codex-skill-children",
      "operationType": "ACTIVATE_RUNTIME_LINK",
      "reasons": [
        "Runtime target already links every source child to the canonical source."
      ],
      "source": {
        "exists": true,
        "kind": "DIRECTORY",
        "path": "/Users/amichne/code/intelligence/skills",
        "resolvedPath": "/Users/amichne/code/intelligence/skills",
        "type": "FILESYSTEM_PATH_CHECK"
      },
      "status": "ALREADY_ACTIVE",
      "target": {
        "exists": true,
        "kind": "SYMLINK",
        "path": "/Users/amichne/.codex/skills",
        "resolvedPath": "/Users/amichne/code/apollo/skills",
        "type": "FILESYSTEM_PATH_CHECK"
      },
      "type": "RUNTIME_ACTIVATION_PREFLIGHT_ENTRY"
    },
    {
      "operationName": "codex-app-marketplace",
      "operationType": "IMPORT_MARKETPLACE",
      "reasons": [
        "Marketplace source is already configured in Codex."
      ],
      "source": {
        "exists": true,
        "kind": "FILE",
        "path": "/Users/amichne/code/intelligence/marketplace.json",
        "resolvedPath": "/Users/amichne/code/intelligence/marketplace.json",
        "type": "FILESYSTEM_PATH_CHECK"
      },
      "status": "ALREADY_ACTIVE",
      "target": {
        "exists": true,
        "kind": "VIRTUAL",
        "path": "codex://plugins?marketplacePath=/Users/amichne/code/intelligence/marketplace.json",
        "type": "FILESYSTEM_PATH_CHECK"
      },
      "type": "RUNTIME_ACTIVATION_PREFLIGHT_ENTRY"
    },
    {
      "backup": {
        "exists": false,
        "kind": "MISSING",
        "path": "/Users/amichne/code/intelligence/.migration-backups/source-turnoff/apollo-skills/agent-profile-authoring",
        "type": "FILESYSTEM_PATH_CHECK"
      },
      "operationName": "replace-apollo-skills-agent-profile-authoring",
      "operationType": "REPLACE_SOURCE_WITH_SYMLINK",
      "reasons": [
        "Replacement target already resolves to the canonical source."
      ],
      "source": {
        "exists": true,
        "kind": "DIRECTORY",
        "path": "/Users/amichne/code/intelligence/skills/agent-profile-authoring",
        "resolvedPath": "/Users/amichne/code/intelligence/skills/agent-profile-authoring",
        "type": "FILESYSTEM_PATH_CHECK"
      },
      "status": "ALREADY_ACTIVE",
      "target": {
        "exists": true,
        "kind": "SYMLINK",
        "path": "/Users/amichne/code/apollo/skills/agent-profile-authoring",
        "resolvedPath": "/Users/amichne/code/intelligence/skills/agent-profile-authoring",
        "type": "FILESYSTEM_PATH_CHECK"
      },
      "type": "RUNTIME_ACTIVATION_PREFLIGHT_ENTRY"
    },
    {
      "backup": {
        "exists": false,
        "kind": "MISSING",
        "path": "/Users/amichne/code/intelligence/.migration-backups/source-turnoff/apollo-skills/github-ci-operations",
        "type": "FILESYSTEM_PATH_CHECK"
      },
      "operationName": "replace-apollo-skills-github-ci-operations",
      "operationType": "REPLACE_SOURCE_WITH_SYMLINK",
      "reasons": [
        "Replacement target already resolves to the canonical source."
      ],
      "source": {
        "exists": true,
        "kind": "DIRECTORY",
        "path": "/Users/amichne/code/intelligence/skills/github-ci-operations",
        "resolvedPath": "/Users/amichne/code/intelligence/skills/github-ci-operations",
        "type": "FILESYSTEM_PATH_CHECK"
      },
      "status": "ALREADY_ACTIVE",
      "target": {
        "exists": true,
        "kind": "SYMLINK",
        "path": "/Users/amichne/code/apollo/skills/github-ci-operations",
        "resolvedPath": "/Users/amichne/code/intelligence/skills/github-ci-operations",
        "type": "FILESYSTEM_PATH_CHECK"
      },
      "type": "RUNTIME_ACTIVATION_PREFLIGHT_ENTRY"
    },
    {
      "backup": {
        "exists": false,
        "kind": "MISSING",
        "path": "/Users/amichne/code/intelligence/.migration-backups/source-turnoff/apollo-skills/hook-primitive-authoring",
        "type": "FILESYSTEM_PATH_CHECK"
      },
      "operationName": "replace-apollo-skills-hook-primitive-authoring",
      "operationType": "REPLACE_SOURCE_WITH_SYMLINK",
      "reasons": [
        "Replacement target already resolves to the canonical source."
      ],
      "source": {
        "exists": true,
        "kind": "DIRECTORY",
        "path": "/Users/amichne/code/intelligence/skills/hook-primitive-authoring",
        "resolvedPath": "/Users/amichne/code/intelligence/skills/hook-primitive-authoring",
        "type": "FILESYSTEM_PATH_CHECK"
      },
      "status": "ALREADY_ACTIVE",
      "target": {
        "exists": true,
        "kind": "SYMLINK",
        "path": "/Users/amichne/code/apollo/skills/hook-primitive-authoring",
        "resolvedPath": "/Users/amichne/code/intelligence/skills/hook-primitive-authoring",
        "type": "FILESYSTEM_PATH_CHECK"
      },
      "type": "RUNTIME_ACTIVATION_PREFLIGHT_ENTRY"
    },
    {
      "backup": {
        "exists": false,
        "kind": "MISSING",
        "path": "/Users/amichne/code/intelligence/.migration-backups/source-turnoff/apollo-skills/local-repository-navigation",
        "type": "FILESYSTEM_PATH_CHECK"
      },
      "operationName": "replace-apollo-skills-local-repository-navigation",
      "operationType": "REPLACE_SOURCE_WITH_SYMLINK",
      "reasons": [
        "Replacement target already resolves to the canonical source."
      ],
      "source": {
        "exists": true,
        "kind": "DIRECTORY",
        "path": "/Users/amichne/code/intelligence/skills/local-repository-navigation",
        "resolvedPath": "/Users/amichne/code/intelligence/skills/local-repository-navigation",
        "type": "FILESYSTEM_PATH_CHECK"
      },
      "status": "ALREADY_ACTIVE",
      "target": {
        "exists": true,
        "kind": "SYMLINK",
        "path": "/Users/amichne/code/apollo/skills/local-repository-navigation",
        "resolvedPath": "/Users/amichne/code/intelligence/skills/local-repository-navigation",
        "type": "FILESYSTEM_PATH_CHECK"
      },
      "type": "RUNTIME_ACTIVATION_PREFLIGHT_ENTRY"
    },
    {
      "backup": {
        "exists": false,
        "kind": "MISSING",
        "path": "/Users/amichne/code/intelligence/.migration-backups/source-turnoff/apollo-skills/plugin-composition-authoring",
        "type": "FILESYSTEM_PATH_CHECK"
      },
      "operationName": "replace-apollo-skills-plugin-composition-authoring",
      "operationType": "REPLACE_SOURCE_WITH_SYMLINK",
      "reasons": [
        "Replacement target already resolves to the canonical source."
      ],
      "source": {
        "exists": true,
        "kind": "DIRECTORY",
        "path": "/Users/amichne/code/intelligence/skills/plugin-composition-authoring",
        "resolvedPath": "/Users/amichne/code/intelligence/skills/plugin-composition-authoring",
        "type": "FILESYSTEM_PATH_CHECK"
      },
      "status": "ALREADY_ACTIVE",
      "target": {
        "exists": true,
        "kind": "SYMLINK",
        "path": "/Users/amichne/code/apollo/skills/plugin-composition-authoring",
        "resolvedPath": "/Users/amichne/code/intelligence/skills/plugin-composition-authoring",
        "type": "FILESYSTEM_PATH_CHECK"
      },
      "type": "RUNTIME_ACTIVATION_PREFLIGHT_ENTRY"
    },
    {
      "backup": {
        "exists": false,
        "kind": "MISSING",
        "path": "/Users/amichne/code/intelligence/.migration-backups/source-turnoff/apollo-skills/primitive-quality-audit",
        "type": "FILESYSTEM_PATH_CHECK"
      },
      "operationName": "replace-apollo-skills-primitive-quality-audit",